event_name,review_text
TechFest 2025,"Amazing event! The speakers were incredibly knowledgeable and the workshops were hands-on. I learned so much about AI and machine learning. The networking opportunities were fantastic too. Highly recommend!"
MusicFest 2025,"The sound quality was excellent and the lineup was diverse. However, the food vendors were overpriced and the lines were too long. Overall a good experience but could be better organized."
Hackathon 2025,"Well-organized event with helpful mentors throughout. The problem statements were challenging yet achievable. Great learning experience and met some talented developers. The prizes were a nice bonus!"
Conference 2025,"The keynote speakers were inspiring and the sessions were informative. However, the venue was too crowded and it was hard to find seating. The coffee breaks were too short."
Workshop 2025,"Excellent hands-on workshop! The instructor was patient and explained everything clearly. We built a real project from scratch. The materials provided were comprehensive. Worth every penny!"
Festival 2025,"Great atmosphere and amazing performances. The food options were diverse and delicious. The only downside was the parking situation - very limited spaces. Would attend again next year!"
Seminar 2025,"The content was relevant and up-to-date. The presenter was engaging and answered all questions thoroughly. The only issue was the room temperature - it was too cold. Otherwise perfect!"
Expo 2025,"Incredible showcase of new technologies! Got to try out cutting-edge products and talk to industry experts. The interactive demos were the highlight. Only wish it lasted longer!"
Meetup 2025,"Small but intimate gathering. Great for networking with like-minded professionals. The discussion topics were thought-provoking. Would love to see more frequent meetups like this."
Summit 2025,"Outstanding event with world-class speakers. The panel discussions were insightful and covered current industry trends. The networking dinner was a great addition. Best conference I've attended this year!"
Webinar 2025,"The online format worked well and the Q&A session was interactive. However, there were some technical glitches with the video streaming. The content was valuable though."
Training 2025,"Comprehensive training program that covered all the essentials. The practical exercises helped reinforce the concepts. The instructor was knowledgeable and approachable. Highly satisfied!"
Launch 2025,"Exciting product launch event! The demonstrations were impressive and the team was passionate. The refreshments were nice. However, the event ran a bit longer than scheduled."
Retreat 2025,"Peaceful and productive environment. Great balance of work sessions and relaxation activities. The accommodations were comfortable. Perfect for team building and brainstorming."
Symposium 2025,"Academic rigor combined with practical insights. The research presentations were fascinating. The coffee breaks allowed for great discussions. Well worth the registration fee!"
Convention 2025,"Massive event with hundreds of exhibitors. Found some great business opportunities. The networking app was helpful for connecting with attendees. Could use better signage though."
Forum 2025,"Engaging discussions on important topics. The moderators kept the conversations on track. The diverse perspectives shared were valuable. Would attend future forums."
Showcase 2025,"Beautiful venue and impressive displays. The artists were talented and the curation was excellent. The opening reception was elegant. A memorable cultural experience!"
Gathering 2025,"Casual and friendly atmosphere. Easy to strike up conversations with other attendees. The activities were fun and interactive. Great way to spend a weekend!"
Celebration 2025,"Joyful event with great energy! The performances were entertaining and the food was delicious. The decorations were beautiful. Everyone seemed to be having a wonderful time!"

